,link,title,company,area,post_time,applicants,level,employment_type,function,industries,detail
0,,,,,,,,,,,
1,https://th.linkedin.com/jobs/view/data-scientist-all-levels-at-accenture-southeast-asia-3166165500?refId=3J%2FZcnEFUlZ%2BHC%2Bvt7qEQA%3D%3D&trackingId=WFM1KN%2BxLofQwBkgoQJt3Q%3D%3D&position=1&pageNum=0&trk=public_jobs_jserp-result_search-card,Data Scientist - All Levels,Accenture Southeast Asia,"Bangkok, Bangkok City, Thailand",1 day ago,125 applicants,Mid-Senior level,Full-time,Research and Strategy/Planning,IT Services and IT Consulting,"About AccentureAccenture is a global professional services company with leading capabilities in digital, cloud, and security. Combining unmatched experience and specialized skills across more than 40 industries, we offer Strategy and Consulting, Interactive, Technology, and Operations services—all powered by the world’s largest network of Advanced Technology and Intelligent Operations centers. Our 506,000 people deliver on the promise of technology and human ingenuity every day, serving clients in more than 120 countries. We embrace the power of change to create value and shared success for our clients, people, shareholders, partners, and communities. Visit us at www.accenture.com or learn more about Accenture Applied Intelligence at https://www.accenture.com/th-en/services/ai-artificial-intelligence-indexAs a team:We have exciting opportunities for a Data Scientist to join our Applied Intelligence practice, part of a larger Strategy & Consulting group. We deliver scalable, business-critical, and end-to-end solutions for our clients - from data strategy/governance to Core Engineering, enabling them to transform and work in Cloud Technologies.You'll learn, grow and advance in an innovative culture that thrives on shared success and diverse ways of thinking and enables boundaryless opportunities that can drive your career in new and exciting ways.Working closely alongside clients and an international team of professionals, you will develop innovative solutions based on their roadmaps, through mediums such as robotics and artificial intelligence. Throughout the blueprint process, you will engage in the development of defense strategies, combining technology and user behavior, to ensure the security of your client. Together we connect the needs of clients with upcoming innovative technologies to prepare them for the future.If you’re looking for a challenging career working in a vibrant environment with access to training and a global network of experts, this could be the role for you. As part of our global team, you'll be working with cutting-edge technologies and will have the opportunity to develop a wide range of new skills on the job.Your job as Data Scientist:Create insights from predictive statistical modeling to deliver client valueApply deep statistical and mathematical knowledge, tools and techniques to find relationships between and among variablesDevelop intellectual property involving specific analytical methodologies, mathematical modeling or optimization techniques and their applications to business issuesTranslate business issues into specific requirements to develop analytic solutions, and identify appropriate data to support the solutionCollaborate with Accenture and/or external consulting teams to address business issues and influence change using strategy, industry and analytical skillsUse machine learning and cloud technologies to improve Client businesses by enabling data science capabilities at scale.The range of your accountability, responsibility and autonomy will depend on your experience and seniority - we are looking for specialists with various experience levels.We are looking for experience and qualifications in the following:Bachelor’s degree in Computer Science, Computer Engineer, Statistics, Applied Mathematics, or other related fieldsHave at least 3 years of practical experience within industry or consulting in applying data-driven approaches to a variety of business scenarios, including creation and use of advanced analytics / Machine Learning algorithms. Banking, Oil & gas, Retail or FMCG experience will be an asset. (New graduates are also welcome for some of our job openings)Are proficient in at least one of programming and query languages like R, Python, PySpark, SQL.Understand various Data Science and Machine Learning concepts and algorithms such as clustering, regression, classification, forecasting, neural networks, hyperparameters optimization, NLP.Understand that Data Engineering is one of the key components of successful delivery in Analytics and are capable of working at any step of analytical model development.Have experience or interest in delivering analytical projects with top Cloud platforms such as GCP, Azure, AWS. Experience with Databricks, BigQuery or AirFlow will be an asset.You understand ML model lifecycle. Practical experience with containerization tools such as Docker, Kubernetes and model lineage tools such as MLflow would be an asset.Experience working in a client-facing/consulting environment is a plusTeam player, analytical and problem-solving skillsGood communication skills both in Thai and EnglishAll of our consulting professionals receive comprehensive training covering business acumen, technical and professional skills development. You’ll also have opportunities to hone your functional skills and expertise in an area of specialization. We offer a variety of formal and informal training programs at every level to help you acquire and build specialized skills faster. Learning takes place both on the job and through formal training conducted online, in the classroom, or in collaboration with teammates. The sheer variety of work we do, and the experience it offers, provide an unbeatable platform from which to build a career.Accenture is an equal opportunities employer and welcomes applications from all sections of society and does not discriminate on grounds of race, religion or belief, ethnic or national origin, disability, age, citizenship, marital, domestic or civil partnership status, sexual orientation, gender identity, or any other basis as protected by applicable law.Equal Employment Opportunity StatementAll employment decisions shall be made without regard to age, race, creed, color, religion, sex, national origin, ancestry, disability status, veteran status, sexual orientation, gender identity or expression, genetic information, marital status, citizenship status or any other basis as protected by federal, state, or local law."
2,https://th.linkedin.com/jobs/view/data-scientist-machine-learning-specialist-scg-packaging-at-scg-3327642755?refId=3J%2FZcnEFUlZ%2BHC%2Bvt7qEQA%3D%3D&trackingId=mTjwFGCY4eD2XcCygtO0XA%3D%3D&position=3&pageNum=0&trk=public_jobs_jserp-result_search-card,Data Scientist (Machine Learning Specialist) - SCG Packaging,SCG,"Bangkok, Bangkok City, Thailand",3 hours ago,Be among the first 25 applicants,Mid-Senior level,Full-time,Information Technology,Packaging and Containers Manufacturing,"Job Summary:Applying machine learning techniques to identify new business opportunities and process improvement using computer vision. Machine learning projects may come from both requirements from internal customers and initiatives from the data science team itself. A candidate may be required to work in the field occasionally if a project is related to a process at operational level.Responsibilities:Identify opportunities for new business / new customers / improvement across SCG Packaging using machine learning/ computer visionCreate a course of recommended actions based on knowledge obtained from machine learning/computer visionFollow up and refine the model by collaborating with related parties until achieving the target resultQualifications:Bachelor / Master/ or Ph.D. in Computer Science/ Computer Engineering/ Electrical Engineering / Statistics / Applied Mathematics / Industrial Engineering with specialization in Machine Learning or related (ฺBachelor G.P.A. > 2.70, Master G.P.A. > 3.30)Proficient in English (TOEIC > 550)Knowledge of statistical techniques and concepts such as regression, time series analysis, statistical distribution, statistical tests.Knowledge and experience in training and apply Machine & Deep Learning algorithms to solve complex problemsExperience using Python, SQL to process data to draw insights from datasets (PySpark to process big data is a plus)Experience in one of the Deep Learning languages: Tensorflow, Pytorch, MxnetExperience in computer vision and image processing is a mustExperience in edge computing architecture relevant to computer visionExperience using MLOps tools such as Kubeflow, MLFlow, or Sagemaker is a plusExperience working in manufacturing and full-stack data science deployment experience. Experience in solving manufacturing problems related operations, quality and supply chain using ML and DL is a plus Positive attitude, Growth Mindset, Eager to learn, and Service mindAble to work upcountry occasionally"
3,https://th.linkedin.com/jobs/view/data-scientist-officer-senior-officer-credit-risk-model-true-money-at-ascend-group-3322052917?refId=3J%2FZcnEFUlZ%2BHC%2Bvt7qEQA%3D%3D&trackingId=rw8BcuJsQMe6CgBIEzUtFA%3D%3D&position=4&pageNum=0&trk=public_jobs_jserp-result_search-card,Data Scientist (Officer-Senior Officer) Credit Risk Model - True Money,Ascend Group,"Bangkok, Bangkok City, Thailand",1 week ago,Be among the first 25 applicants,Associate,Full-time,"Other, Information Technology, and Management","Technology, Information and Internet","We are looking for a self-motivated, naturally curious person interested in solving complex lending issues in new and innovative ways. This individual must utilize expertise to query, design and translate complex data analysis into simple, user-friendly mediums that are easily digestible by business units and stakeholders. Candidates must be comfortable working on a team and have strong communication and presentation skills. The Data Scientist will have direct reporting responsibility to the machine leaning team lead. Job responsibilities:Develop, monitor, maintain, optimize machine learning models in compliance with the model governanceConduct statistical analysis and provide statistical information to support lending business as well as assist other business functions by providing necessary toolsPartner with the various lines of business to enhance modeling and analytical frameworkSupervise junior and senior analysts on end-to-end model development processRequirement skills:Bachelor’s Degree in Computer Science, Operations Research, Engineering, or related quantitative discipline.2-5 years of experiences in programming languages such as Python, SQL or Scala5+ years of hands-on experience in building & implementing AI/ML solutions for senior roleExperience with python libraries - Numpy, scikit-learn, OpenCV, Tensorflow, Pytorch, Flask, DjangoExperience with source version control (Git, Bitbucket)Proven knowledge on Rest API, Docker, Google Big Query, VScodeStrong analytical skills and data-driven thinking"
4,https://th.linkedin.com/jobs/view/machine-learning-engineer-officer-senior-officer-credit-risk-model-true-money-at-ascend-group-3322060022?refId=3J%2FZcnEFUlZ%2BHC%2Bvt7qEQA%3D%3D&trackingId=GTrebu%2F4WjMRH7K20qh3Sg%3D%3D&position=5&pageNum=0&trk=public_jobs_jserp-result_search-card,Machine Learning Engineer (Officer-Senior Officer) - Credit Risk Model (True Money),Ascend Group,"Bangkok, Bangkok City, Thailand",1 week ago,Be among the first 25 applicants,Associate,Full-time,"Other, Information Technology, and Management","Technology, Information and Internet","We are looking for a self-motivated, naturally curious person interested in solving complex lending issues in new and innovative ways. This individual must utilize expertise to query, design and translate complex data analysis into simple, user-friendly mediums that are easily digestible by business units and stakeholders. Candidates must be comfortable working on a team and have strong communication and presentation skills. The Data Scientist will have direct reporting responsibility to the machine leaning team lead.Job responsibilities:Design an ML production system end-to-end: project scoping, data needs, modeling strategies, and deployment requirementsEstablish a model baseline, address concept drift, and prototype how to develop, deploy, and continuously improve a productionized ML applicationBuild data pipelines by gathering, cleaning, and validating datasets.Establish data lifecycle by using data lineage and provenance metadata toolsApply best practices and progressive delivery techniques to maintain and monitor a continuously operating production system.Requirement skills:Bachelor’s Degree in Computer Science, Operations Research, Engineering, or related quantitative discipline. 2-5 years of experiences in programming languages such as Python, SQL or Scala 5+ years of hands-on experience in building & implementing AI/ML solutions for senior roleExperience with python libraries - Numpy, scikit-learn, OpenCV, Tensorflow, Pytorch, Flask, DjangoExperience with source version control (Git, Bitbucket)Proven knowledge on Rest API, Docker, Google Big Query, VScodeStrong analytical skills and data-driven thinking"
5,https://th.linkedin.com/jobs/view/data-scientist-true-leasing-%40lardkrabang-at-true-leasing-co-ltd-3326834019?refId=3J%2FZcnEFUlZ%2BHC%2Bvt7qEQA%3D%3D&trackingId=oioDvArQzZeZuauw4HsARg%3D%3D&position=7&pageNum=0&trk=public_jobs_jserp-result_search-card,Data Scientist - True Leasing @Lardkrabang,"True Leasing Co. Ltd.,",Bangkok Metropolitan Area,1 day ago,Be among the first 25 applicants,Mid-Senior level,Full-time,Information Technology,IT Services and IT Consulting,"Job Responsibilities• Collaborates with IT to prepare and manipulate structured and unstructured data for data discovery and mining from multiple, disparate, resources.• Builds high-end analytic models, utilizing supervised and unsupervised learning models, to support decision makers with data driven insights that address immediate business problems and objectives.• Creates informative visualizations that intuitively display large amounts of data and/or complex relationships.• Translates data analytics into coherent reports and presentations for internal and external customer with varying degrees of technical knowledgeSkills and Qualifications• 2years+ related work experience in application development and/or systems analysis role.• Passion for analytical problem solving.• Pro-active problem solver who continually asks why to understand root causes.• Experience with R or Python, SQL.• Knowledge of advanced statistical techniques and concepts (regression, properties of distributions, statistical tests and proper usage, etc.) and experience with applications.• Knowledge of machine learning techniques and approaches (feature engineering, classification, clustering, decision trees, etc.).• Knowledge of time series analysis and forecasting a plus.• Quick learner through formal and self-guided education.• Ability to work in teams or individually.• Excellent written and verbal communication skills for coordinating across teams"
6,https://th.linkedin.com/jobs/view/technology-consulting-data-analytics-staff-at-ey-2941112891?refId=3J%2FZcnEFUlZ%2BHC%2Bvt7qEQA%3D%3D&trackingId=Vbdu%2FU2OTD6FEOumO3JpBg%3D%3D&position=8&pageNum=0&trk=public_jobs_jserp-result_search-card,Technology Consulting - Data Analytics (Staff),EY,"Bangkok, Bangkok City, Thailand",18 hours ago,Over 200 applicants,Entry level,Full-time,Information Technology,Accounting,"At EY, you’ll have the chance to build a career as unique as you are, with the global scale, support, inclusive culture and technology to become the best version of you. And we’re counting on your unique voice and perspective to help EY become even better, too. Join us and build an exceptional experience for yourself, and a better working world for all.Technology Consulting - Data Analytics Engineer EY delivers unparalleled tech consulting services in data strategy, big data engineering, business intelligence, digital, machine learning and Artificial Intelligence. We help clients understand, architect, select and implement leading-edge solutions to drive their business. We leverage leading practices and a high degree of business acumen that has been compiled over years of experience to deliver the highest level of execution and satisfaction for our clients. Our approach is focused on analysing business needs and making sure that the solutions delivered meet our client’s goals.The opportunityEY is investing significantly in the build out of Data and AI services that leverage Microsoft Azure. This is a rapidly growing area, and you will have the opportunity to lead and develop your skill set to keep up with the ever-growing demands of data strategy, the modern data platform and enterprise data fabric landscape, that support data science, business intelligence, artificial intelligence, and cloud applications at scale.Expand your horizons solving real-world challenges with complex data sets and advanced-analytics tools. Work with exceptional colleagues and clients to build analytics capabilities that break new ground, transform industries, and shape markets. You will help clients in developing tactical strategies and roadmaps for designing and building data, analytics, and AI solutions that will enable better business outcomes for clients. You will work across client business and technology stakeholders to provide strategic advice, determine solution requirements and success criteria and rationalize architecture and operating decisions. You will manage teams that will clean, transform, and aggregate data; compile and install database systems; write complex queries; scale to multiple machines; and put disaster-recovery systems in place—all with a sharp eye on what is important for the client. This is a high growth, high visibility area with plenty of opportunities to enhance your skillset and build your career. Your Key ResponsibilitiesAs an Data Analytics, you will be focusing on translating client’s business ambitions and objectives into detailed target states and tactical roadmaps, leading more junior team members, and working with a wide variety of clients to deliver technology consulting services. You will be the go-to resource for understanding our clients’ problems through data gathering and analysis. You will use your background in big-data problem solving to collect, analyze, and present findings and solutions.Skills And Attributes For SuccessTranslating business requirements to technical solutions leveraging strong business acumen.You will be a core member of the EY Microsoft Data and AI team, responsible for extracting large quantities of data from client’s IT systems, developing efficient ETL and data management processes, and building architectures for rapid ingestion and dissemination of key data.Apply expertise in quantitative analysis, data mining and presentation of data to develop compelling and accurate analytical reports and dashboards to support metrics, historical data trend analysis, and identification of opportunities to drive continuous improvementExtremely flexible and experience managing multiple tasks and priorities on deadlinesApplying technical knowledge to architect solutions that meet business and IT needs, create Data Platform roadmaps, and enable the Data Platforms to scale to support additional use casesStaying abreast of current business and industry trends relevant to the client's businessMonitoring progress, managing risk, and ensuring key stakeholders are kept informed about progress and expected outcomes.Understanding customers’ overall data estate, IT and business priorities and success measures to design implementation architectures and solutions.Strong team collaboration and experience working with remote teams.Working on large-scale client engagements. Fostering relationships with client personnel at appropriate levels. Consistently delivering quality client services. Driving high-quality work products within expected timeframes and on budget.Demonstrated significant professional experience of commercial, strategy and/or research/analytics interacting with senior stakeholders to effectively communicate insights.Execute on building data solutions for business intelligence and assist in effectively managing and monitoring the data ecosystem of analytics, data lakes, warehouses platforms and toolsProvide directional guidance and recommendations around data flows including data technology, data integrations, data models, and data storage formatsTo qualify for the role, you must haveBachelor’s degree, or MS degree in Business, Economics, Technology Entrepreneurship, Computer Science, Informatics, Statistics, Applied Mathematics, Data Science, or Machine Learning.Minimum of 0-1 years of relevant consulting experience with focus on advanced analytics and business intelligence or similar roles. New graduated are welcome! Communication and critical thinking are essential, must be able to listen and understand the question and develop and deliver clear insightsExperience communicating the results of analysis to both technical and non-technical audiencesIndependent and able to manage and prioritize workloadAbility to adapt quickly and positively to changeBreadth of technical passion, desire to learn and knowledge servicesWillingness and ability to travel to meet client if needIdeally, you’ll also haveExperience working business or IT transformation projects that have supported data science, business intelligence, artificial intelligence, and cloud applications at scaleAbility to communicate clearly and succinctly, adjusts to a variety of styles and audiences with ability to tell compelling stories with the data.Experience with C#, VBA, JavaScript, RA vast understanding of key BI trends and the BI vendor landscapeWorking experience with Agile and/or Scrum methods of deliveryWorking experience with design led thinkingMicrosoft Certifications in the Data & AI domainWhat We Look ForWe’re interested in passionate leaders with strong vision and a desire to deeply understand the trends at the intersection of business and Data and AI. We want a customer-focused professional who is motivated to drive the creation of great enterprise products and who can collaborate and partner with other product teams, and engineers. If you have a genuine passion for helping businesses achieve the full potential of their data, this role is for you.What We OfferWe offer a competitive compensation package where you’ll be rewarded based on your performance and recognized for the value you bring to our business. In addition, our Total Rewards package includes medical and dental coverage, pension and 401(k) plans, and a wide range of paid time off options. Under our flexible vacation policy, you’ll decide how much vacation time you need based on your own personal circumstances. You’ll also be granted time off for designated EY Paid Holidays, Winter/Summer breaks, Personal/Family Care, and other leaves of absence when needed to support your physical, financial, and emotional well-being. Continuous learning: You’ll develop the mindset and skills to navigate whatever comes next. Success as defined by you: We’ll provide the tools and flexibility, so you can make a meaningful impact, your way. Transformative leadership: We’ll give you the insights, coaching and confidence to be the leader the world needs. Diverse and inclusive culture: You’ll be embraced for who you are and empowered to use your voice to help others find theirs.If you can demonstrate that you meet the criteria above, please contact us as soon as possible.The exceptional EY experience. It’s yours to build.EY | Building a better working worldEY exists to build a better working world, helping to create long-term value for clients, people and society and build trust in the capital markets.Enabled by data and technology, diverse EY teams in over 150 countries provide trust through assurance and help clients grow, transform and operate.Working across assurance, consulting, law, strategy, tax and transactions, EY teams ask better questions to find new answers for the complex issues facing our world today.EY is an equal opportunity, affirmative action employer providing equal employment opportunities to applicants and employees without regard to race, color, religion, age, sex, sexual orientation, gender identity/expression, national origin, protected veteran status, disability status, or any other legally protected basis, in accordance with applicable law."
