,link,title,company,area,post_time,applicants,level,employment_type,function,industries,detail
23,https://th.linkedin.com/jobs/view/insights-analyst-bangkok-based-relocation-provided-at-agoda-3329369433?refId=3J%2FZcnEFUlZ%2BHC%2Bvt7qEQA%3D%3D&trackingId=if35p5y2iYBoY15TH%2FidEQ%3D%3D&position=25&pageNum=0&trk=public_jobs_jserp-result_search-card,"Insights Analyst (Bangkok Based, relocation provided)",Agoda,"Bangkok, Bangkok City, Thailand",19 hours ago,Be among the first 25 applicants,Associate,Full-time,"Research, Analyst, and Information Technology","Technology, Information and Internet","About AgodaAgoda is an online travel booking platform for accommodations, flights, and more. We build and deploy cutting-edge technology that connects travelers with more than 2.5 million accommodations globally. Based in Asia and part of Booking Holdings, our 4,000+ employees representing 90+ nationalities foster a work environment rich in diversity, creativity, and collaboration. We innovate through a culture of experimentation and ownership, enhancing the ability for our customers to experience the world. In this Role, you’ll get  to: Search: Experiment with text ads, bidding, and campaign structures on Google, Bing, Baidu, Naver, and other search engines. Adapt to new product features and roll out changes from successful testsDisplay: Test, analyze, and optimize campaigns on Facebook, Twitter, Instagram, and othersModeling: Analyze the vast amounts of data generated by experiments, develop models we can use for optimization, and build dashboards for account managers What you’ll Need to  Succeed: Bachelor’s Degree or higher from top university in a quantitative subject (computer science, mathematics, engineering, or science)Ability to communicate fluently in English2+ years’ experience in top-tier management consulting, investment banking, private equity, or strategy/business operations for a fast-growing globally operating tech companyExposure to one or more data analysis packages or databases, e.g., SAS, R, SPSS, Python, VBA, SQLGood numerical reasoning skillsProficiency in ExcelIntellectual curiosity It’s Great if you  Have: Experience in digital marketingAcademic research experience  #STRA#ANLS#MRKT#3 #sanfrancisco #sanjose #losangeles #sandiego #oakland #denver #miami #orlando #atlanta #chicago #boston #detroit #newyork #portland #philadelphia #dallas #houston #austin #seattle #washdc #tirana #yerevan #sydney #melbourne #perth #vienna #graz #linz #baku #minsk #brussels #antwerp #ghent #charleroi #liege #saopaolo #sofia #toronto #vancouver #montreal #shanghai #beijing #shenzhen #zagreb #cyprus #prague #Brno #Ostrava #copenhagen #cairo #alexandria #giza #estonia #helsinki #paris #nice #marseille #rouen #lyon #toulouse #tbilisi #berlin #munich #hamburg #stuttgart #cologne #frankfurt #dusseldorf #dortmund #essen #Bremen #leipzig #dresden #hanover #nuremberg #athens #hongkong #budapest #bangalore #newdelhi #jakarta #bali #bandung #dublin #telaviv #milan #rome #naples #turin #palermo #venice #bologna #florence #tokyo #osaka #yokohama #nagoya #okinawa #fukuoka #sapporo #amman #irbid #riga #beirut #tripoli #vilnius #luxembourg #kualalumpur #malta #chisinau #amsterdam #oslo #jerusalem #manila #warsaw #krakow #sintra #lisbon #porto #braga #cascais #loures #amadora #almada #doha #alrayyan #bucharest #moscow #saintpetersburg #riyadh #jeddah #mecca #medina #belgrade #singapore #bratislava #capetown #johannesburg #seoul #barcelona #madrid #valencia #seville #bilbao #malaga #oviedo #alicante #laspalmas #zaragozbanga #stockholm #zurich #geneva #basel #taipei #tainan #taichung #kaohsiung #Phuket #bangkok #istanbul #ankara #izmir #dubai #abudhabi #sharjah #london #manchester #liverpool #edinburgh #kiev #hcmc #hanoi #sanaa #taiz #aden #gibraltar #marrakech #lodz #wroclaw #poznan #Gdansk #szczecin #bydgoszcz #lublin #katowice #rio #salvador #fortaleza #brasilia #belo #belem #manaus #curitiba #portoalegre #saoluis data representation data analysis SQL data analytics analytics python (programming language) data mining data science r (programming language) tableau analytical skills data visualization databases business analysis business intelligence (bi) microsoft sql server machine learning statistics microsoft power bi java finance shopee traveloka google facebook ctrip trip.com makemytrip grab amazon pandas (software) artificial intelligence (ai) information technology capital one accenture upwork deloitte mckinsey bain microsoft uber lyft gojek lazada alibaba shopify expedia skyscanner Equal Opportunity Employer At Agoda, we pride ourselves on being a company represented by people of all different backgrounds and orientations. We prioritize attracting diverse talent and cultivating an inclusive environment that encourages collaboration and innovation. Employment at Agoda is based solely on a person’s merit and qualifications. We are committed to providing equal employment opportunity regardless of sex, age, race, color, national origin, religion, marital status, pregnancy, sexual orientation, gender identity, disability, citizenship, veteran or military status, and other legally protected characteristics.We will keep your application on file so that we can consider you for future vacancies and you can always ask to have your details removed from the file. For more details please read our privacy policy .To all recruitment agencies: Agoda does not accept third party resumes. Please do not send resumes to our jobs alias, Agoda employees or any other organization location. Agoda is not responsible for any fees related to unsolicited resumes."
24,https://th.linkedin.com/jobs/view/technical-account-manager-google-cloud-at-google-3320817772?refId=op3lhz5Gn%2BAk6j%2B1vKe9yQ%3D%3D&trackingId=FKTZAm0b%2BHXwhIN3%2B2WLrg%3D%3D&position=1&pageNum=1&trk=public_jobs_jserp-result_search-card,"Technical Account Manager, Google Cloud",Google,"Bangkok, Bangkok City, Thailand",2 days ago,52 applicants,Not Applicable,Full-time,"Project Management, Consulting, and Engineering","Information Services and Technology, Information and Internet","Minimum qualifications:Bachelor’s degree in Computer Science, Engineering, related technical field, or equivalent practical experience.5 years of experience in customer-facing, interfacing with stakeholders, driving customer technical implementation, or transformation programs.Experience working across business units internally and at enterprises, and translating business requirements into technological solutions.Experience in application/workload migration to public cloud providers.Preferred qualifications:Experience supporting customers in one of the following: cloud operations (e.g., launch and capacity planning, product release management), technical support, escalation management, IT consulting.Understanding of one of the following: IT operations, database systems, networking, IT security, application development, service architecture, cloud-native application development, hosted services, storage systems, or content delivery networks.Ability to travel domestically and internationally 25% of the time, as needed.Ability to speak and write in Thai fluently to foster and develop key relationships with new and existing Thai-speaking partners in APAC.About The JobThe Google Cloud Platform team helps customers transform and build what's next for their business — all with technology built in the cloud. Our products are engineered for security, reliability and scalability, running the full stack from infrastructure to applications to devices and hardware. Our teams are dedicated to helping our customers — developers, small and large businesses, educational institutions and government agencies — see the benefits of our technology come to life. As part of an entrepreneurial team in this rapidly growing business, you will play a key role in understanding the needs of our customers and help shape the future of businesses of all sizes use technology to connect with customers, employees and partners.As a Technical Account Manager, you will draw on customer-facing skills and technical acumen to help customers adopt Google Cloud products. Your experience with cloud infrastructure, program management, enterprise technology implementation, strategy development and customer advocacy will play a part in your day-to-day work driving success at our most critical customers.In this role, you will lead the adoption of Google Cloud at leading organizations, guiding them through the strategic and technical facets of their Cloud transformation journey. You will manage the delivery of professional services engagements to drive customer adoption of Google Cloud services, like Google Compute Engine, Google Cloud Machine Learning and many more. You will regularly engage with diverse stakeholders, including executives of large enterprises and a cross-functional and geographically dispersed team.Google Cloud accelerates organizations’ ability to digitally transform their business with the best infrastructure, platform, industry solutions and expertise. We deliver enterprise-grade solutions that leverage Google’s cutting-edge technology – all on the cleanest cloud in the industry. Customers in more than 200 countries and territories turn to Google Cloud as their trusted partner to enable growth and solve their most critical business problems.ResponsibilitiesAccelerate customer adoption of Google Cloud by leading the implementation journey. Provide technical guidance and manage timelines, milestones, migration goal and business transformation strategies.Advocate for customer needs in order to overcome adoption blockers and drive new feature development. Guide multiple work streams and teams to maintain customer momentum. Develop strategic relationships with key stakeholders to understand a customer’s business and develop strategic roadmaps. Lead quarterly business reviews and executive sessions to understand business and technical needs. Plan for customer events and launches, partnering with Support, Engineering and Site Reliability Engineering (SRE) to ensure customer success. Work with customers and support to guide issues and escalations to resolution.Develop best practices and assets based on learnings from customer engagements to help support initiatives to scale through partners and accelerate cloud adoption.Google is proud to be an equal opportunity workplace and is an affirmative action employer. We are committed to equal employment opportunity regardless of race, color, ancestry, religion, sex, national origin, sexual orientation, age, citizenship, marital status, disability, gender identity or Veteran status. We also consider qualified applicants regardless of criminal histories, consistent with legal requirements. See also Google's EEO Policy and EEO is the Law. If you have a disability or special need that requires accommodation, please let us know by completing our Accommodations for Applicants form ."
25,https://th.linkedin.com/jobs/view/data-analyst-strategic-partnerships-bangkok-based-at-agoda-3329367310?refId=op3lhz5Gn%2BAk6j%2B1vKe9yQ%3D%3D&trackingId=hdQ0aH9E%2Fl1Bo%2FDzDGohEw%3D%3D&position=2&pageNum=1&trk=public_jobs_jserp-result_search-card,"Data Analyst, Strategic Partnerships( Bangkok based)",Agoda,"Bangkok, Bangkok City, Thailand",19 hours ago,Be among the first 25 applicants,Associate,Full-time,Information Technology,"Technology, Information and Internet","About AgodaAgoda is an online travel booking platform for accommodations, flights, and more. We build and deploy cutting-edge technology that connects travelers with more than 2.5 million accommodations globally. Based in Asia and part of Booking Holdings, our 4,000+ employees representing 90+ nationalities foster a work environment rich in diversity, creativity, and collaboration. We innovate through a culture of experimentation and ownership, enhancing the ability for our customers to experience the world.Key Areas of Focus:In this role, you’ll get to: Strategy: Conduct analyses to identify growth opportunities and prioritize investment areas in APAC for Strategic Partnerships team based on analytical insights, industry trends, and changing competitive landscape.Analytics: Leverage data & tools to analyze SP performance and identify appropriate levers to improve performance.Cross-functional projects: Work with different teams inside SP (B2B, White Label, Affiliates, Financial Institutions, different markets across APAC, etc.) and outside of SP (product, marketing, supply, finance, etc.) to drive initiatives.Performance management: Maintain and optimize a performance management system for the department, including a large team of account managersData & tools: Oversee SP data infrastructure to ensure data accuracy, completeness, and timeliness. Design, manage, and oversee the maintenance of data tools to support decision making.Performance reporting: Preparing updates on business performance, proposals, and recommendations to senior management.Pricing Experiments: Optimize pricing strategy and make decisions based on A/B experiments.What you’ll Need to Succeed:  total experience with Consulting, Data Analytics, Strategy, Business Development, Business Intelligence, or other relevant fields Proven ability to leverage analytics and quantitative methods to break down ambiguous problems and come up with recommendations Growth mindset and excited to work on a variety of functional areasEntrepreneurial and not afraid to be hands-on on the work Experience working in a fast-paced and high growth environment Excellent communication skills (both verbal and written in English) with ability to work well across multiple stakeholders It’s Great if you have:  Ability to write in SQL a plus, or willingness to learn Ability to use Tableau a plus, or willingness to learn Bachelor’s degree in Statistics, Computer Science, Economics, Mathematics a plus   #STRA#ANLS#MRKT#3 #sanfrancisco #sanjose #losangeles #sandiego #oakland #denver #miami #orlando #atlanta #chicago #boston #detroit #newyork #portland #philadelphia #dallas #houston #austin #seattle #washdc #tirana #yerevan #sydney #melbourne #perth #vienna #graz #linz #baku #minsk #brussels #antwerp #ghent #charleroi #liege #saopaolo #sofia #toronto #vancouver #montreal #shanghai #beijing #shenzhen #zagreb #cyprus #prague #Brno #Ostrava #copenhagen #cairo #alexandria #giza #estonia #helsinki #paris #nice #marseille #rouen #lyon #toulouse #tbilisi #berlin #munich #hamburg #stuttgart #cologne #frankfurt #dusseldorf #dortmund #essen #Bremen #leipzig #dresden #hanover #nuremberg #athens #hongkong #budapest #bangalore #newdelhi #jakarta #bali #bandung #dublin #telaviv #milan #rome #naples #turin #palermo #venice #bologna #florence #tokyo #osaka #yokohama #nagoya #okinawa #fukuoka #sapporo #amman #irbid #riga #beirut #tripoli #vilnius #luxembourg #kualalumpur #malta #chisinau #amsterdam #oslo #jerusalem #manila #warsaw #krakow #sintra #lisbon #porto #braga #cascais #loures #amadora #almada #doha #alrayyan #bucharest #moscow #saintpetersburg #riyadh #jeddah #mecca #medina #belgrade #singapore #bratislava #capetown #johannesburg #seoul #barcelona #madrid #valencia #seville #bilbao #malaga #oviedo #alicante #laspalmas #zaragozbanga #stockholm #zurich #geneva #basel #taipei #tainan #taichung #kaohsiung #Phuket #bangkok #istanbul #ankara #izmir #dubai #abudhabi #sharjah #london #manchester #liverpool #edinburgh #kiev #hcmc #hanoi #sanaa #taiz #aden #gibraltar #marrakech #lodz #wroclaw #poznan #Gdansk #szczecin #bydgoszcz #lublin #katowice #rio #salvador #fortaleza #brasilia #belo #belem #manaus #curitiba #portoalegre #saoluis data representation data analysis SQL data analytics analytics python (programming language) data mining data science r (programming language) tableau analytical skills data visualization databases business analysis business intelligence (bi) microsoft sql server machine learning statistics microsoft power bi java finance shopee traveloka google facebook ctrip trip.com makemytrip grab amazon pandas (software) artificial intelligence (ai) information technology capital one accenture upwork deloitte mckinsey bain microsoft uber lyft gojek lazada alibaba shopify expedia skyscanner Equal Opportunity Employer At Agoda, we pride ourselves on being a company represented by people of all different backgrounds and orientations. We prioritize attracting diverse talent and cultivating an inclusive environment that encourages collaboration and innovation. Employment at Agoda is based solely on a person’s merit and qualifications. We are committed to providing equal employment opportunity regardless of sex, age, race, color, national origin, religion, marital status, pregnancy, sexual orientation, gender identity, disability, citizenship, veteran or military status, and other legally protected characteristics.We will keep your application on file so that we can consider you for future vacancies and you can always ask to have your details removed from the file. For more details please read our privacy policy .To all recruitment agencies: Agoda does not accept third party resumes. Please do not send resumes to our jobs alias, Agoda employees or any other organization location. Agoda is not responsible for any fees related to unsolicited resumes."
26,https://th.linkedin.com/jobs/view/business-analyst-strategic-partnerships-bangkok-based-at-agoda-3329368421?refId=op3lhz5Gn%2BAk6j%2B1vKe9yQ%3D%3D&trackingId=XhdUqWecXpFfuJ1oxek2iA%3D%3D&position=3&pageNum=1&trk=public_jobs_jserp-result_search-card,"Business Analyst, Strategic Partnerships( Bangkok based)",Agoda,"Bangkok, Bangkok City, Thailand",19 hours ago,Be among the first 25 applicants,Associate,Full-time,"Research, Analyst, and Information Technology","Technology, Information and Internet","About AgodaAgoda is an online travel booking platform for accommodations, flights, and more. We build and deploy cutting-edge technology that connects travelers with more than 2.5 million accommodations globally. Based in Asia and part of Booking Holdings, our 4,000+ employees representing 90+ nationalities foster a work environment rich in diversity, creativity, and collaboration. We innovate through a culture of experimentation and ownership, enhancing the ability for our customers to experience the world.Key Areas of Focus:In this role, you’ll get to: Strategy: Conduct analyses to identify growth opportunities and prioritize investment areas in APAC for Strategic Partnerships team based on analytical insights, industry trends, and changing competitive landscape.Analytics: Leverage data & tools to analyze SP performance and identify appropriate levers to improve performance.Cross-functional projects: Work with different teams inside SP (B2B, White Label, Affiliates, Financial Institutions, different markets across APAC, etc.) and outside of SP (product, marketing, supply, finance, etc.) to drive initiatives.Performance management: Maintain and optimize a performance management system for the department, including a large team of account managersData & tools: Oversee SP data infrastructure to ensure data accuracy, completeness, and timeliness. Design, manage, and oversee the maintenance of data tools to support decision making.Performance reporting: Preparing updates on business performance, proposals, and recommendations to senior management.Pricing Experiments: Optimize pricing strategy and make decisions based on A/B experiments.What you’ll Need to Succeed: Minimum of 3-5 years of total experience with Consulting, Data Analytics, Strategy, Business Development, Business Intelligence, or other relevant fields Proven ability to leverage analytics and quantitative methods to break down ambiguous problems and come up with recommendations Growth mindset and excited to work on a variety of functional areasEntrepreneurial and not afraid to be hands-on on the work Experience working in a fast-paced and high growth environment Excellent communication skills (both verbal and written in English) with ability to work well across multiple stakeholders It’s Great if you have:  Ability to write in SQL a plus, or willingness to learn Ability to use Tableau a plus, or willingness to learn Bachelor’s degree in Statistics, Computer Science, Economics, Mathematics a plus   #STRA#ANLS#MRKT#3 #sanfrancisco #sanjose #losangeles #sandiego #oakland #denver #miami #orlando #atlanta #chicago #boston #detroit #newyork #portland #philadelphia #dallas #houston #austin #seattle #washdc #tirana #yerevan #sydney #melbourne #perth #vienna #graz #linz #baku #minsk #brussels #antwerp #ghent #charleroi #liege #saopaolo #sofia #toronto #vancouver #montreal #shanghai #beijing #shenzhen #zagreb #cyprus #prague #Brno #Ostrava #copenhagen #cairo #alexandria #giza #estonia #helsinki #paris #nice #marseille #rouen #lyon #toulouse #tbilisi #berlin #munich #hamburg #stuttgart #cologne #frankfurt #dusseldorf #dortmund #essen #Bremen #leipzig #dresden #hanover #nuremberg #athens #hongkong #budapest #bangalore #newdelhi #jakarta #bali #bandung #dublin #telaviv #milan #rome #naples #turin #palermo #venice #bologna #florence #tokyo #osaka #yokohama #nagoya #okinawa #fukuoka #sapporo #amman #irbid #riga #beirut #tripoli #vilnius #luxembourg #kualalumpur #malta #chisinau #amsterdam #oslo #jerusalem #manila #warsaw #krakow #sintra #lisbon #porto #braga #cascais #loures #amadora #almada #doha #alrayyan #bucharest #moscow #saintpetersburg #riyadh #jeddah #mecca #medina #belgrade #singapore #bratislava #capetown #johannesburg #seoul #barcelona #madrid #valencia #seville #bilbao #malaga #oviedo #alicante #laspalmas #zaragozbanga #stockholm #zurich #geneva #basel #taipei #tainan #taichung #kaohsiung #Phuket #bangkok #istanbul #ankara #izmir #dubai #abudhabi #sharjah #london #manchester #liverpool #edinburgh #kiev #hcmc #hanoi #sanaa #taiz #aden #gibraltar #marrakech #lodz #wroclaw #poznan #Gdansk #szczecin #bydgoszcz #lublin #katowice #rio #salvador #fortaleza #brasilia #belo #belem #manaus #curitiba #portoalegre #saoluis data representation data analysis SQL data analytics analytics python (programming language) data mining data science r (programming language) tableau analytical skills data visualization databases business analysis business intelligence (bi) microsoft sql server machine learning statistics microsoft power bi java finance shopee traveloka google facebook ctrip trip.com makemytrip grab amazon pandas (software) artificial intelligence (ai) information technology capital one accenture upwork deloitte mckinsey bain microsoft uber lyft gojek lazada alibaba shopify expedia skyscanner Equal Opportunity Employer At Agoda, we pride ourselves on being a company represented by people of all different backgrounds and orientations. We prioritize attracting diverse talent and cultivating an inclusive environment that encourages collaboration and innovation. Employment at Agoda is based solely on a person’s merit and qualifications. We are committed to providing equal employment opportunity regardless of sex, age, race, color, national origin, religion, marital status, pregnancy, sexual orientation, gender identity, disability, citizenship, veteran or military status, and other legally protected characteristics.We will keep your application on file so that we can consider you for future vacancies and you can always ask to have your details removed from the file. For more details please read our privacy policy .To all recruitment agencies: Agoda does not accept third party resumes. Please do not send resumes to our jobs alias, Agoda employees or any other organization location. Agoda is not responsible for any fees related to unsolicited resumes."
