,link,title,company,area,post_time,applicants,level,employment_type,function,industries,detail
56,https://th.linkedin.com/jobs/view/analyst-specialist-bangkok-based-relocation-provided-at-agoda-3325191063?refId=W6OMMRNa6sBs3cOLQjMgjA%3D%3D&trackingId=GmAItfMrjvax65BoyK%2Bcbg%3D%3D&position=8&pageNum=2&trk=public_jobs_jserp-result_search-card,"Analyst / Specialist (Bangkok Based, relocation provided)",Agoda,"Bangkok, Bangkok City, Thailand",1 day ago,Be among the first 25 applicants,Associate,Full-time,Business Development and Sales,"Technology, Information and Internet","About AgodaAgoda is an online travel booking platform for accommodations, flights, and more. We build and deploy cutting-edge technology that connects travelers with more than 2.5 million accommodations globally. Based in Asia and part of Booking Holdings, our 4,000+ employees representing 90+ nationalities foster a work environment rich in diversity, creativity, and collaboration. We innovate through a culture of experimentation and ownership, enhancing the ability for our customers to experience the world. Get to Know our  Team: The Performance Marketing Team of Agoda is a world leader in online marketing. This department is highly data-driven and focused on developing at-scale marketing programs that improve the lifetime value of Agoda customers through measurable marketing programs and channels. The team is a blend of the best analysts, marketing strategists, and data scientists in the world. The marketing leadership at Agoda have deep experience in data science, product, strategy, and other marketing fields and have built an organization that thrives on data, creative ideas, and technology. The Performance Marketing Team also fosters a great learning environment. You will be able to learn and grow by working closely with experts from a variety of backgrounds from all over the world. In this Role, you’ll get  to: Search: Experiment with text ads, bidding, and campaign structures on Google, Bing, Baidu, Naver, and other search engines. Adapt to new product features and roll out changes from successful testsDisplay: Test, analyze, and optimize campaigns on Facebook, Twitter, Instagram, and othersModeling: Analyze the vast amounts of data generated by experiments, develop models we can use for optimization, and build dashboards for account managers What you’ll Need to  Succeed: Bachelor’s Degree or higher from top university in a quantitative subject (computer science, mathematics, engineering, or science)Ability to communicate fluently in EnglishExperience in top-tier management consulting, investment banking, private equity, or strategy/business operations for a fast-growing globally operating tech companyExposure to one or more data analysis packages or databases, e.g., SAS, R, SPSS, Python, VBA, SQLGood numerical reasoning skillsProficiency in ExcelIntellectual curiosity It’s Great if you  Have: Experience in digital marketingAcademic research experience  #STRA#ANLS#MRKT#3 #sanfrancisco #sanjose #losangeles #sandiego #oakland #denver #miami #orlando #atlanta #chicago #boston #detroit #newyork #portland #philadelphia #dallas #houston #austin #seattle #washdc #tirana #yerevan #sydney #melbourne #perth #vienna #graz #linz #baku #minsk #brussels #antwerp #ghent #charleroi #liege #saopaolo #sofia #toronto #vancouver #montreal #shanghai #beijing #shenzhen #zagreb #cyprus #prague #Brno #Ostrava #copenhagen #cairo #alexandria #giza #estonia #helsinki #paris #nice #marseille #rouen #lyon #toulouse #tbilisi #berlin #munich #hamburg #stuttgart #cologne #frankfurt #dusseldorf #dortmund #essen #Bremen #leipzig #dresden #hanover #nuremberg #athens #hongkong #budapest #bangalore #newdelhi #jakarta #bali #bandung #dublin #telaviv #milan #rome #naples #turin #palermo #venice #bologna #florence #tokyo #osaka #yokohama #nagoya #okinawa #fukuoka #sapporo #amman #irbid #riga #beirut #tripoli #vilnius #luxembourg #kualalumpur #malta #chisinau #amsterdam #oslo #jerusalem #manila #warsaw #krakow #sintra #lisbon #porto #braga #cascais #loures #amadora #almada #doha #alrayyan #bucharest #moscow #saintpetersburg #riyadh #jeddah #mecca #medina #belgrade #singapore #bratislava #capetown #johannesburg #seoul #barcelona #madrid #valencia #seville #bilbao #malaga #oviedo #alicante #laspalmas #zaragozbanga #stockholm #zurich #geneva #basel #taipei #tainan #taichung #kaohsiung #Phuket #bangkok #istanbul #ankara #izmir #dubai #abudhabi #sharjah #london #manchester #liverpool #edinburgh #kiev #hcmc #hanoi #sanaa #taiz #aden #gibraltar #marrakech #lodz #wroclaw #poznan #Gdansk #szczecin #bydgoszcz #lublin #katowice #rio #salvador #fortaleza #brasilia #belo #belem #manaus #curitiba #portoalegre #saoluis data representation data analysis SQL data analytics analytics python (programming language) data mining data science r (programming language) tableau analytical skills data visualization databases business analysis business intelligence (bi) microsoft sql server machine learning statistics microsoft power bi java finance shopee traveloka google facebook ctrip trip.com makemytrip grab amazon pandas (software) artificial intelligence (ai) information technology capital one accenture upwork deloitte mckinsey bain microsoft uber lyft gojek lazada alibaba shopify expedia skyscanner #entrylevel Equal Opportunity Employer At Agoda, we pride ourselves on being a company represented by people of all different backgrounds and orientations. We prioritize attracting diverse talent and cultivating an inclusive environment that encourages collaboration and innovation. Employment at Agoda is based solely on a person’s merit and qualifications. We are committed to providing equal employment opportunity regardless of sex, age, race, color, national origin, religion, marital status, pregnancy, sexual orientation, gender identity, disability, citizenship, veteran or military status, and other legally protected characteristics.We will keep your application on file so that we can consider you for future vacancies and you can always ask to have your details removed from the file. For more details please read our privacy policy .To all recruitment agencies: Agoda does not accept third party resumes. Please do not send resumes to our jobs alias, Agoda employees or any other organization location. Agoda is not responsible for any fees related to unsolicited resumes."
57,https://th.linkedin.com/jobs/view/senior-data-analyst-bangkok-based-relocation-provided-at-agoda-3329365416?refId=W6OMMRNa6sBs3cOLQjMgjA%3D%3D&trackingId=DpVxLCuadKQy15xsLjhb5g%3D%3D&position=9&pageNum=2&trk=public_jobs_jserp-result_search-card,"Senior Data Analyst (Bangkok Based, relocation provided)",Agoda,"Bangkok, Bangkok City, Thailand",19 hours ago,Be among the first 25 applicants,Associate,Full-time,Information Technology,"Technology, Information and Internet","About AgodaAgoda is an online travel booking platform for accommodations, flights, and more. We build and deploy cutting-edge technology that connects travelers with more than 2.5 million accommodations globally. Based in Asia and part of Booking Holdings, our 4,000+ employees representing 90+ nationalities foster a work environment rich in diversity, creativity, and collaboration. We innovate through a culture of experimentation and ownership, enhancing the ability for our customers to experience the world. In this Role, you’ll get  to: Search: Experiment with text ads, bidding, and campaign structures on Google, Bing, Baidu, Naver, and other search engines. Adapt to new product features and roll out changes from successful testsDisplay: Test, analyze, and optimize campaigns on Facebook, Twitter, Instagram, and othersModeling: Analyze the vast amounts of data generated by experiments, develop models we can use for optimization, and build dashboards for account managers What you’ll Need to  Succeed: Bachelor’s Degree or higher from top university in a quantitative subject (computer science, mathematics, engineering, or science)Ability to communicate fluently in English3+ years’ experience in top-tier management consulting, investment banking, private equity, or strategy/business operations for a fast-growing globally operating tech companyExposure to one or more data analysis packages or databases, e.g., SAS, R, SPSS, Python, VBA, SQLGood numerical reasoning skillsProficiency in ExcelIntellectual curiosity It’s Great if you  Have: Experience in digital marketingAcademic research experience  #STRA#ANLS#MRKT#3 #sanfrancisco #sanjose #losangeles #sandiego #oakland #denver #miami #orlando #atlanta #chicago #boston #detroit #newyork #portland #philadelphia #dallas #houston #austin #seattle #washdc #tirana #yerevan #sydney #melbourne #perth #vienna #graz #linz #baku #minsk #brussels #antwerp #ghent #charleroi #liege #saopaolo #sofia #toronto #vancouver #montreal #shanghai #beijing #shenzhen #zagreb #cyprus #prague #Brno #Ostrava #copenhagen #cairo #alexandria #giza #estonia #helsinki #paris #nice #marseille #rouen #lyon #toulouse #tbilisi #berlin #munich #hamburg #stuttgart #cologne #frankfurt #dusseldorf #dortmund #essen #Bremen #leipzig #dresden #hanover #nuremberg #athens #hongkong #budapest #bangalore #newdelhi #jakarta #bali #bandung #dublin #telaviv #milan #rome #naples #turin #palermo #venice #bologna #florence #tokyo #osaka #yokohama #nagoya #okinawa #fukuoka #sapporo #amman #irbid #riga #beirut #tripoli #vilnius #luxembourg #kualalumpur #malta #chisinau #amsterdam #oslo #jerusalem #manila #warsaw #krakow #sintra #lisbon #porto #braga #cascais #loures #amadora #almada #doha #alrayyan #bucharest #moscow #saintpetersburg #riyadh #jeddah #mecca #medina #belgrade #singapore #bratislava #capetown #johannesburg #seoul #barcelona #madrid #valencia #seville #bilbao #malaga #oviedo #alicante #laspalmas #zaragozbanga #stockholm #zurich #geneva #basel #taipei #tainan #taichung #kaohsiung #Phuket #bangkok #istanbul #ankara #izmir #dubai #abudhabi #sharjah #london #manchester #liverpool #edinburgh #kiev #hcmc #hanoi #sanaa #taiz #aden #gibraltar #marrakech #lodz #wroclaw #poznan #Gdansk #szczecin #bydgoszcz #lublin #katowice #rio #salvador #fortaleza #brasilia #belo #belem #manaus #curitiba #portoalegre #saoluis data representation data analysis SQL data analytics analytics python (programming language) data mining data science r (programming language) tableau analytical skills data visualization databases business analysis business intelligence (bi) microsoft sql server machine learning statistics microsoft power bi java finance shopee traveloka google facebook ctrip trip.com makemytrip grab amazon pandas (software) artificial intelligence (ai) information technology capital one accenture upwork deloitte mckinsey bain microsoft uber lyft gojek lazada alibaba shopify expedia skyscanner Equal Opportunity Employer At Agoda, we pride ourselves on being a company represented by people of all different backgrounds and orientations. We prioritize attracting diverse talent and cultivating an inclusive environment that encourages collaboration and innovation. Employment at Agoda is based solely on a person’s merit and qualifications. We are committed to providing equal employment opportunity regardless of sex, age, race, color, national origin, religion, marital status, pregnancy, sexual orientation, gender identity, disability, citizenship, veteran or military status, and other legally protected characteristics.We will keep your application on file so that we can consider you for future vacancies and you can always ask to have your details removed from the file. For more details please read our privacy policy .To all recruitment agencies: Agoda does not accept third party resumes. Please do not send resumes to our jobs alias, Agoda employees or any other organization location. Agoda is not responsible for any fees related to unsolicited resumes."
58,https://th.linkedin.com/jobs/view/senior-business-analyst-bangkok-based-relocation-provided-at-agoda-3329369293?refId=W6OMMRNa6sBs3cOLQjMgjA%3D%3D&trackingId=QxNiIoHK01n87GByQuj3RQ%3D%3D&position=10&pageNum=2&trk=public_jobs_jserp-result_search-card,"Senior Business Analyst (Bangkok Based, relocation provided)",Agoda,"Bangkok, Bangkok City, Thailand",19 hours ago,Be among the first 25 applicants,Associate,Full-time,"Research, Analyst, and Information Technology","Technology, Information and Internet","About AgodaAgoda is an online travel booking platform for accommodations, flights, and more. We build and deploy cutting-edge technology that connects travelers with more than 2.5 million accommodations globally. Based in Asia and part of Booking Holdings, our 4,000+ employees representing 90+ nationalities foster a work environment rich in diversity, creativity, and collaboration. We innovate through a culture of experimentation and ownership, enhancing the ability for our customers to experience the world. In this Role, you’ll get  to: Search: Experiment with text ads, bidding, and campaign structures on Google, Bing, Baidu, Naver, and other search engines. Adapt to new product features and roll out changes from successful testsDisplay: Test, analyze, and optimize campaigns on Facebook, Twitter, Instagram, and othersModeling: Analyze the vast amounts of data generated by experiments, develop models we can use for optimization, and build dashboards for account managers What you’ll Need to  Succeed: Bachelor’s Degree or higher from top university in a quantitative subject (computer science, mathematics, engineering, or science)Ability to communicate fluently in English2+ years’ experience in top-tier management consulting, investment banking, private equity, or strategy/business operations for a fast-growing globally operating tech companyExposure to one or more data analysis packages or databases, e.g., SAS, R, SPSS, Python, VBA, SQLGood numerical reasoning skillsProficiency in ExcelIntellectual curiosity It’s Great if you  Have: Experience in digital marketingAcademic research experience  #STRA#ANLS#MRKT#3 #sanfrancisco #sanjose #losangeles #sandiego #oakland #denver #miami #orlando #atlanta #chicago #boston #detroit #newyork #portland #philadelphia #dallas #houston #austin #seattle #washdc #tirana #yerevan #sydney #melbourne #perth #vienna #graz #linz #baku #minsk #brussels #antwerp #ghent #charleroi #liege #saopaolo #sofia #toronto #vancouver #montreal #shanghai #beijing #shenzhen #zagreb #cyprus #prague #Brno #Ostrava #copenhagen #cairo #alexandria #giza #estonia #helsinki #paris #nice #marseille #rouen #lyon #toulouse #tbilisi #berlin #munich #hamburg #stuttgart #cologne #frankfurt #dusseldorf #dortmund #essen #Bremen #leipzig #dresden #hanover #nuremberg #athens #hongkong #budapest #bangalore #newdelhi #jakarta #bali #bandung #dublin #telaviv #milan #rome #naples #turin #palermo #venice #bologna #florence #tokyo #osaka #yokohama #nagoya #okinawa #fukuoka #sapporo #amman #irbid #riga #beirut #tripoli #vilnius #luxembourg #kualalumpur #malta #chisinau #amsterdam #oslo #jerusalem #manila #warsaw #krakow #sintra #lisbon #porto #braga #cascais #loures #amadora #almada #doha #alrayyan #bucharest #moscow #saintpetersburg #riyadh #jeddah #mecca #medina #belgrade #singapore #bratislava #capetown #johannesburg #seoul #barcelona #madrid #valencia #seville #bilbao #malaga #oviedo #alicante #laspalmas #zaragozbanga #stockholm #zurich #geneva #basel #taipei #tainan #taichung #kaohsiung #Phuket #bangkok #istanbul #ankara #izmir #dubai #abudhabi #sharjah #london #manchester #liverpool #edinburgh #kiev #hcmc #hanoi #sanaa #taiz #aden #gibraltar #marrakech #lodz #wroclaw #poznan #Gdansk #szczecin #bydgoszcz #lublin #katowice #rio #salvador #fortaleza #brasilia #belo #belem #manaus #curitiba #portoalegre #saoluis data representation data analysis SQL data analytics analytics python (programming language) data mining data science r (programming language) tableau analytical skills data visualization databases business analysis business intelligence (bi) microsoft sql server machine learning statistics microsoft power bi java finance shopee traveloka google facebook ctrip trip.com makemytrip grab amazon pandas (software) artificial intelligence (ai) information technology capital one accenture upwork deloitte mckinsey bain microsoft uber lyft gojek lazada alibaba shopify expedia skyscanner Equal Opportunity Employer At Agoda, we pride ourselves on being a company represented by people of all different backgrounds and orientations. We prioritize attracting diverse talent and cultivating an inclusive environment that encourages collaboration and innovation. Employment at Agoda is based solely on a person’s merit and qualifications. We are committed to providing equal employment opportunity regardless of sex, age, race, color, national origin, religion, marital status, pregnancy, sexual orientation, gender identity, disability, citizenship, veteran or military status, and other legally protected characteristics.We will keep your application on file so that we can consider you for future vacancies and you can always ask to have your details removed from the file. For more details please read our privacy policy .To all recruitment agencies: Agoda does not accept third party resumes. Please do not send resumes to our jobs alias, Agoda employees or any other organization location. Agoda is not responsible for any fees related to unsolicited resumes."
59,https://th.linkedin.com/jobs/view/senior-analyst-or-associate-manager-marketing-strategy-bangkok-based-relocation-provided-at-agoda-3329363787?refId=W6OMMRNa6sBs3cOLQjMgjA%3D%3D&trackingId=LfK8Kz9s2KtAK7eVu7B9qg%3D%3D&position=11&pageNum=2&trk=public_jobs_jserp-result_search-card,"Senior Analyst or Associate Manager, Marketing Strategy (Bangkok Based, relocation provided)",Agoda,"Bangkok, Bangkok City, Thailand",19 hours ago,Be among the first 25 applicants,Associate,Full-time,Marketing and Sales,"Technology, Information and Internet","About AgodaAgoda is an online travel booking platform for accommodations, flights, and more. We build and deploy cutting-edge technology that connects travelers with more than 2.5 million accommodations globally. Based in Asia and part of Booking Holdings, our 4,000+ employees representing 90+ nationalities foster a work environment rich in diversity, creativity, and collaboration. We innovate through a culture of experimentation and ownership, enhancing the ability for our customers to experience the world. Get to Know our  Team: The Performance Marketing Team of Agoda is a world leader in online marketing. This department is highly data-driven and focused on developing at-scale marketing programs that improve the lifetime value of Agoda customers through measurable marketing programs and channels. The team is a blend of the best analysts, marketing strategists, and data scientists in the world. The marketing leadership at Agoda have deep experience in data science, product, strategy, and other marketing fields and have built an organization that thrives on data, creative ideas, and technology. The Performance Marketing Team also fosters a great learning environment. You will be able to learn and grow by working closely with experts from a variety of backgrounds from all over the world. In this Role, you’ll get  to: Search: Experiment with text ads, bidding, and campaign structures on Google, Bing, Baidu, Naver, and other search engines. Adapt to new product features and roll out changes from successful testsDisplay: Test, analyze, and optimize campaigns on Facebook, Twitter, Instagram, and othersModeling: Analyze the vast amounts of data generated by experiments, develop models we can use for optimization, and build dashboards for account managers What you’ll Need to  Succeed: Bachelor’s Degree or higher from top university in a quantitative subject (computer science, mathematics, engineering, or science)Ability to communicate fluently in English4+ years’ experience in top-tier management consulting, investment banking, private equity, or strategy/business operations for a fast-growing globally operating tech companyExposure to one or more data analysis packages or databases, e.g., SAS, R, SPSS, Python, VBA, SQLGood numerical reasoning skillsProficiency in ExcelIntellectual curiosity It’s Great if you  Have: Experience in digital marketingAcademic research experience#STRA#ANLS#MRKT#3 #sanfrancisco #sanjose #losangeles #sandiego #oakland #denver #miami #orlando #atlanta #chicago #boston #detroit #newyork #portland #philadelphia #dallas #houston #austin #seattle #washdc #tirana #yerevan #sydney #melbourne #perth #vienna #graz #linz #baku #minsk #brussels #antwerp #ghent #charleroi #liege #saopaolo #sofia #toronto #vancouver #montreal #shanghai #beijing #shenzhen #zagreb #cyprus #prague #Brno #Ostrava #copenhagen #cairo #alexandria #giza #estonia #helsinki #paris #nice #marseille #rouen #lyon #toulouse #tbilisi #berlin #munich #hamburg #stuttgart #cologne #frankfurt #dusseldorf #dortmund #essen #Bremen #leipzig #dresden #hanover #nuremberg #athens #hongkong #budapest #bangalore #newdelhi #jakarta #bali #bandung #dublin #telaviv #milan #rome #naples #turin #palermo #venice #bologna #florence #tokyo #osaka #yokohama #nagoya #okinawa #fukuoka #sapporo #amman #irbid #riga #beirut #tripoli #vilnius #luxembourg #kualalumpur #malta #chisinau #amsterdam #oslo #jerusalem #manila #warsaw #krakow #sintra #lisbon #porto #braga #cascais #loures #amadora #almada #doha #alrayyan #bucharest #moscow #saintpetersburg #riyadh #jeddah #mecca #medina #belgrade #singapore #bratislava #capetown #johannesburg #seoul #barcelona #madrid #valencia #seville #bilbao #malaga #oviedo #alicante #laspalmas #zaragozbanga #stockholm #zurich #geneva #basel #taipei #tainan #taichung #kaohsiung #Phuket #bangkok #istanbul #ankara #izmir #dubai #abudhabi #sharjah #london #manchester #liverpool #edinburgh #kiev #hcmc #hanoi #sanaa #taiz #aden #gibraltar #marrakech #lodz #wroclaw #poznan #Gdansk #szczecin #bydgoszcz #lublin #katowice #rio #salvador #fortaleza #brasilia #belo #belem #manaus #curitiba #portoalegre #saoluis data representation data analysis SQL data analytics analytics python (programming language) data mining data science r (programming language) tableau analytical skills data visualization databases business analysis business intelligence (bi) microsoft sql server machine learning statistics microsoft power bi java finance shopee traveloka google facebook ctrip trip.com makemytrip grab amazon pandas (software) artificial intelligence (ai) information technology capital one accenture upwork deloitte mckinsey bain microsoft uber lyft gojek lazada alibaba shopify expedia skyscannerEqual Opportunity Employer At Agoda, we pride ourselves on being a company represented by people of all different backgrounds and orientations. We prioritize attracting diverse talent and cultivating an inclusive environment that encourages collaboration and innovation. Employment at Agoda is based solely on a person’s merit and qualifications. We are committed to providing equal employment opportunity regardless of sex, age, race, color, national origin, religion, marital status, pregnancy, sexual orientation, gender identity, disability, citizenship, veteran or military status, and other legally protected characteristics.We will keep your application on file so that we can consider you for future vacancies and you can always ask to have your details removed from the file. For more details please read our privacy policy .To all recruitment agencies: Agoda does not accept third party resumes. Please do not send resumes to our jobs alias, Agoda employees or any other organization location. Agoda is not responsible for any fees related to unsolicited resumes."
