,link,title,company,area,post_time,applicants,level,employment_type,function,industries,detail
39,https://th.linkedin.com/jobs/view/analyst-bangkok-based-relocation-provided-at-agoda-3329364790?refId=op3lhz5Gn%2BAk6j%2B1vKe9yQ%3D%3D&trackingId=gal%2BBlWtXxJw84qsBXvVlA%3D%3D&position=16&pageNum=1&trk=public_jobs_jserp-result_search-card,"Analyst (Bangkok Based, relocation provided)",Agoda,"Bangkok, Bangkok City, Thailand",19 hours ago,Be among the first 25 applicants,Associate,Full-time,Business Development and Sales,"Technology, Information and Internet","About AgodaAgoda is an online travel booking platform for accommodations, flights, and more. We build and deploy cutting-edge technology that connects travelers with more than 2.5 million accommodations globally. Based in Asia and part of Booking Holdings, our 4,000+ employees representing 90+ nationalities foster a work environment rich in diversity, creativity, and collaboration. We innovate through a culture of experimentation and ownership, enhancing the ability for our customers to experience the world. In this Role, you’ll get  to: Search: Experiment with text ads, bidding, and campaign structures on Google, Bing, Baidu, Naver, and other search engines. Adapt to new product features and roll out changes from successful testsDisplay: Test, analyze, and optimize campaigns on Facebook, Twitter, Instagram, and othersModeling: Analyze the vast amounts of data generated by experiments, develop models we can use for optimization, and build dashboards for account managers What you’ll Need to  Succeed: Bachelor’s Degree or higher from top university in a quantitative subject (computer science, mathematics, engineering, or science)Ability to communicate fluently in English2+ years’ experience in top-tier management consulting, investment banking, private equity, or strategy/business operations for a fast-growing globally operating tech companyExposure to one or more data analysis packages or databases, e.g., SAS, R, SPSS, Python, VBA, SQLGood numerical reasoning skillsProficiency in ExcelIntellectual curiosity It’s Great if you  Have: Experience in digital marketingAcademic research experience  #STRA#ANLS#MRKT#3 #sanfrancisco #sanjose #losangeles #sandiego #oakland #denver #miami #orlando #atlanta #chicago #boston #detroit #newyork #portland #philadelphia #dallas #houston #austin #seattle #washdc #tirana #yerevan #sydney #melbourne #perth #vienna #graz #linz #baku #minsk #brussels #antwerp #ghent #charleroi #liege #saopaolo #sofia #toronto #vancouver #montreal #shanghai #beijing #shenzhen #zagreb #cyprus #prague #Brno #Ostrava #copenhagen #cairo #alexandria #giza #estonia #helsinki #paris #nice #marseille #rouen #lyon #toulouse #tbilisi #berlin #munich #hamburg #stuttgart #cologne #frankfurt #dusseldorf #dortmund #essen #Bremen #leipzig #dresden #hanover #nuremberg #athens #hongkong #budapest #bangalore #newdelhi #jakarta #bali #bandung #dublin #telaviv #milan #rome #naples #turin #palermo #venice #bologna #florence #tokyo #osaka #yokohama #nagoya #okinawa #fukuoka #sapporo #amman #irbid #riga #beirut #tripoli #vilnius #luxembourg #kualalumpur #malta #chisinau #amsterdam #oslo #jerusalem #manila #warsaw #krakow #sintra #lisbon #porto #braga #cascais #loures #amadora #almada #doha #alrayyan #bucharest #moscow #saintpetersburg #riyadh #jeddah #mecca #medina #belgrade #singapore #bratislava #capetown #johannesburg #seoul #barcelona #madrid #valencia #seville #bilbao #malaga #oviedo #alicante #laspalmas #zaragozbanga #stockholm #zurich #geneva #basel #taipei #tainan #taichung #kaohsiung #Phuket #bangkok #istanbul #ankara #izmir #dubai #abudhabi #sharjah #london #manchester #liverpool #edinburgh #kiev #hcmc #hanoi #sanaa #taiz #aden #gibraltar #marrakech #lodz #wroclaw #poznan #Gdansk #szczecin #bydgoszcz #lublin #katowice #rio #salvador #fortaleza #brasilia #belo #belem #manaus #curitiba #portoalegre #saoluis data representation data analysis SQL data analytics analytics python (programming language) data mining data science r (programming language) tableau analytical skills data visualization databases business analysis business intelligence (bi) microsoft sql server machine learning statistics microsoft power bi java finance shopee traveloka google facebook ctrip trip.com makemytrip grab amazon pandas (software) artificial intelligence (ai) information technology capital one accenture upwork deloitte mckinsey bain microsoft uber lyft gojek lazada alibaba shopify expedia skyscanner Equal Opportunity Employer At Agoda, we pride ourselves on being a company represented by people of all different backgrounds and orientations. We prioritize attracting diverse talent and cultivating an inclusive environment that encourages collaboration and innovation. Employment at Agoda is based solely on a person’s merit and qualifications. We are committed to providing equal employment opportunity regardless of sex, age, race, color, national origin, religion, marital status, pregnancy, sexual orientation, gender identity, disability, citizenship, veteran or military status, and other legally protected characteristics.We will keep your application on file so that we can consider you for future vacancies and you can always ask to have your details removed from the file. For more details please read our privacy policy .To all recruitment agencies: Agoda does not accept third party resumes. Please do not send resumes to our jobs alias, Agoda employees or any other organization location. Agoda is not responsible for any fees related to unsolicited resumes."
40,https://th.linkedin.com/jobs/view/analyst-marketing-innovation-bangkok-based-relocation-provided-at-agoda-3329370194?refId=op3lhz5Gn%2BAk6j%2B1vKe9yQ%3D%3D&trackingId=iSEflsBZBX2%2FtArigWaC8A%3D%3D&position=17&pageNum=1&trk=public_jobs_jserp-result_search-card,"Analyst, Marketing Innovation (Bangkok Based, relocation provided)",Agoda,"Bangkok, Bangkok City, Thailand",19 hours ago,Be among the first 25 applicants,Associate,Full-time,Marketing and Sales,"Technology, Information and Internet","About AgodaAgoda is an online travel booking platform for accommodations, flights, and more. We build and deploy cutting-edge technology that connects travelers with more than 2.5 million accommodations globally. Based in Asia and part of Booking Holdings, our 4,000+ employees representing 90+ nationalities foster a work environment rich in diversity, creativity, and collaboration. We innovate through a culture of experimentation and ownership, enhancing the ability for our customers to experience the world. Get to Know our  Team: The Performance Marketing Team of Agoda is a world leader in online marketing. This department is highly data-driven and focused on developing at-scale marketing programs that improve the lifetime value of Agoda customers through measurable marketing programs and channels. The team is a blend of the best analysts, marketing strategists, and data scientists in the world. The marketing leadership at Agoda have deep experience in data science, product, strategy, and other marketing fields and have built an organization that thrives on data, creative ideas, and technology. The Performance Marketing Team also fosters a great learning environment. You will be able to learn and grow by working closely with experts from a variety of backgrounds from all over the world. In this Role, you’ll get  to: Search: Experiment with text ads, bidding, and campaign structures on Google, Bing, Baidu, Naver, and other search engines. Adapt to new product features and roll out changes from successful testsDisplay: Test, analyze, and optimize campaigns on Facebook, Twitter, Instagram, and othersModeling: Analyze the vast amounts of data generated by experiments, develop models we can use for optimization, and build dashboards for account managers What you’ll Need to  Succeed: Bachelor’s Degree or higher from top university in a quantitative subject (computer science, mathematics, engineering, or science)Ability to communicate fluently in English2+ years’ experience in top-tier management consulting, investment banking, private equity, or strategy/business operations for a fast-growing globally operating tech companyExposure to one or more data analysis packages or databases, e.g., SAS, R, SPSS, Python, VBA, SQLGood numerical reasoning skillsProficiency in ExcelIntellectual curiosity It’s Great if you  Have: Experience in digital marketingAcademic research experience#STRA#ANLS#MRKT#3 #sanfrancisco #sanjose #losangeles #sandiego #oakland #denver #miami #orlando #atlanta #chicago #boston #detroit #newyork #portland #philadelphia #dallas #houston #austin #seattle #washdc #tirana #yerevan #sydney #melbourne #perth #vienna #graz #linz #baku #minsk #brussels #antwerp #ghent #charleroi #liege #saopaolo #sofia #toronto #vancouver #montreal #shanghai #beijing #shenzhen #zagreb #cyprus #prague #Brno #Ostrava #copenhagen #cairo #alexandria #giza #estonia #helsinki #paris #nice #marseille #rouen #lyon #toulouse #tbilisi #berlin #munich #hamburg #stuttgart #cologne #frankfurt #dusseldorf #dortmund #essen #Bremen #leipzig #dresden #hanover #nuremberg #athens #hongkong #budapest #bangalore #newdelhi #jakarta #bali #bandung #dublin #telaviv #milan #rome #naples #turin #palermo #venice #bologna #florence #tokyo #osaka #yokohama #nagoya #okinawa #fukuoka #sapporo #amman #irbid #riga #beirut #tripoli #vilnius #luxembourg #kualalumpur #malta #chisinau #amsterdam #oslo #jerusalem #manila #warsaw #krakow #sintra #lisbon #porto #braga #cascais #loures #amadora #almada #doha #alrayyan #bucharest #moscow #saintpetersburg #riyadh #jeddah #mecca #medina #belgrade #singapore #bratislava #capetown #johannesburg #seoul #barcelona #madrid #valencia #seville #bilbao #malaga #oviedo #alicante #laspalmas #zaragozbanga #stockholm #zurich #geneva #basel #taipei #tainan #taichung #kaohsiung #Phuket #bangkok #istanbul #ankara #izmir #dubai #abudhabi #sharjah #london #manchester #liverpool #edinburgh #kiev #hcmc #hanoi #sanaa #taiz #aden #gibraltar #marrakech #lodz #wroclaw #poznan #Gdansk #szczecin #bydgoszcz #lublin #katowice #rio #salvador #fortaleza #brasilia #belo #belem #manaus #curitiba #portoalegre #saoluis data representation data analysis SQL data analytics analytics python (programming language) data mining data science r (programming language) tableau analytical skills data visualization databases business analysis business intelligence (bi) microsoft sql server machine learning statistics microsoft power bi java finance shopee traveloka google facebook ctrip trip.com makemytrip grab amazon pandas (software) artificial intelligence (ai) information technology capital one accenture upwork deloitte mckinsey bain microsoft uber lyft gojek lazada alibaba shopify expedia skyscannerEqual Opportunity Employer At Agoda, we pride ourselves on being a company represented by people of all different backgrounds and orientations. We prioritize attracting diverse talent and cultivating an inclusive environment that encourages collaboration and innovation. Employment at Agoda is based solely on a person’s merit and qualifications. We are committed to providing equal employment opportunity regardless of sex, age, race, color, national origin, religion, marital status, pregnancy, sexual orientation, gender identity, disability, citizenship, veteran or military status, and other legally protected characteristics.We will keep your application on file so that we can consider you for future vacancies and you can always ask to have your details removed from the file. For more details please read our privacy policy .To all recruitment agencies: Agoda does not accept third party resumes. Please do not send resumes to our jobs alias, Agoda employees or any other organization location. Agoda is not responsible for any fees related to unsolicited resumes."
41,https://th.linkedin.com/jobs/view/mechanical-automation-engineer-at-lumentum-3168487142?refId=op3lhz5Gn%2BAk6j%2B1vKe9yQ%3D%3D&trackingId=OarUEh6ur5AyrFchyCrcxw%3D%3D&position=18&pageNum=1&trk=public_jobs_jserp-result_search-card,Mechanical Automation Engineer,Lumentum,"Bang Luang, Pathum Thani, Thailand",3 days ago,67 applicants,Entry level,Full-time,Engineering and Information Technology,Telecommunications,"It's fun to work in a company where people truly BELIEVE in what they're doing!We're committed to bringing passion and customer focus to the business.If you like wild growth and working with happy, enthusiastic over-achievers, you'll enjoy your career with us!Role and ResponsibleExploring and Implementing new ways to automate systemsDesigning and testing automation equipment and processesProgramming new automated componentsIdentifying quality issues and making a report to fix the design issues Collaborating with Automation Manufacturing PartnerDesign automation processes and equipment with LEAN philosophyAble to do sanity check with no interfere in movement partsInitiate automation documents such as electrical/pneumatic diagrams , service manual and etc.Trace on port-mortem on design and document once faultsInitiate SOW for each assigned projectQualificationsMinimum of a Bachelor’s Degree in electrical engineering, mechanical engineering or similar fieldExperience with SOLIDWORK design on 3D and 2D drawingExperience with simulation for accommodate with design reviewProficiency in maintaining automation equipmentExperience with robotics, AI and machine learningExperience with project managementSolid understanding of computer programming and software developmentAbility to troubleshoot equipment and perform complex system testsStrong leadership and problem-solving skillsExcellent organizational skills and attention to detailCreative thinking skillsExcellent verbal and written communication skillsStrong analytical skillsAbility to communicate well with other members of the development team Excellent manual dexterityAbility to keep up with the latest technologiesA desire to continually upgrade technical knowledge"
42,https://th.linkedin.com/jobs/view/senior-data-analyst-partner-development-%E2%80%93-statistics-ml-bi-bangkok-based-relocation-provided-at-agoda-3329364705?refId=op3lhz5Gn%2BAk6j%2B1vKe9yQ%3D%3D&trackingId=Pw3Ywt2TCQveafI9p0aoFQ%3D%3D&position=19&pageNum=1&trk=public_jobs_jserp-result_search-card,"Senior Data Analyst, Partner Development – (Statistics/ML/BI) (Bangkok-based, relocation provided)",Agoda,"Bangkok, Bangkok City, Thailand",19 hours ago,Be among the first 25 applicants,Associate,Full-time,Information Technology,"Technology, Information and Internet","About AgodaAgoda is an online travel booking platform for accommodations, flights, and more. We build and deploy cutting-edge technology that connects travelers with more than 2.5 million accommodations globally. Based in Asia and part of Booking Holdings, our 4,000+ employees representing 90+ nationalities foster a work environment rich in diversity, creativity, and collaboration. We innovate through a culture of experimentation and ownership, enhancing the ability for our customers to experience the world.Get to know our team:Partner Development is a team of creative entrepreneurs that develop solutions for Agoda’s accommodation partners and promote Agoda’s top and bottom line growth. We design tailored business and product solutions with our partners and help them generate measurable value. Members of our team are empowered and supported to grow their market(s) or accounts. We develop win-win relationships and leverage Agoda’s unique accommodations portfolio and tech solutions to bring our partners the advantages they seek. Utilizing our strong brand and resources, we roll out new product to increase the visibility of Agoda, introduce more travelers to our great products and service and deliver significant revenues to the overall business.In this role you’ll get toThis role is designed to mainly growth opportunity identification among mid to long tail hotels, experiment execution and data tracking within Partner Development team for the global teams. You will get to work directly with the regional team to design and put in place global experimentation and initiatives to drive tangible impact in each market.Key activities involved include but not limit to:Apply your expertise in quantitative analysis, data mining, and the presentation of data to identify opportunities for business improvements and support your recommendationsOwn end-to-end project or roll out new experiments to validate in-market impact of an initiative within Partner DevelopmentBuild dashboards, identify new and track key metrics to closely monitor team’s performance and identify quick and long term opportunities for improvementsWork closely with cross-functional teams of analysts, regional team leads, product managers and business owners to drive changes based on opportunities identifiedSupport global Partner Development related initiatives, including experimentation infrastructure-building and methodology standardizationWhat You’ll Need To SucceedBachelor’s degree in science, computer science, statistics, economics, mathematics, or similar quantitative discipline4-8 years experience working in a business analysis, data analysis, reporting or business strategy roleExcellent problem-solving skills including the ability to analyze and resolve complex problems using dataTeam player with strong interpersonal, relationship-building, and stakeholder management skillsCoding skills for analytics and data manipulation (SQL, R, Python, Pandas, Scala)Data visualization tool experience such as with Tableau or your weapon of choiceAbility to work under pressure in a fast-paced and rapidly changing environmentExcellent communication skills (both verbal and written in English), with proven ability to convey complex messages clearly and with conviction#STRA#ANLS#MRKT#3 #sanfrancisco #sanjose #losangeles #sandiego #oakland #denver #miami #orlando #atlanta #chicago #boston #detroit #newyork #portland #philadelphia #dallas #houston #austin #seattle #washdc #tirana #yerevan #sydney #melbourne #perth #vienna #graz #linz #baku #minsk #brussels #antwerp #ghent #charleroi #liege #saopaolo #sofia #toronto #vancouver #montreal #shanghai #beijing #shenzhen #zagreb #cyprus #prague #Brno #Ostrava #copenhagen #cairo #alexandria #giza #estonia #helsinki #paris #nice #marseille #rouen #lyon #toulouse #tbilisi #berlin #munich #hamburg #stuttgart #cologne #frankfurt #dusseldorf #dortmund #essen #Bremen #leipzig #dresden #hanover #nuremberg #athens #hongkong #budapest #bangalore #newdelhi #jakarta #bali #bandung #dublin #telaviv #milan #rome #naples #turin #palermo #venice #bologna #florence #tokyo #osaka #yokohama #nagoya #okinawa #fukuoka #sapporo #amman #irbid #riga #beirut #tripoli #vilnius #luxembourg #kualalumpur #malta #chisinau #amsterdam #oslo #jerusalem #manila #warsaw #krakow #sintra #lisbon #porto #braga #cascais #loures #amadora #almada #doha #alrayyan #bucharest #moscow #saintpetersburg #riyadh #jeddah #mecca #medina #belgrade #singapore #bratislava #capetown #johannesburg #seoul #barcelona #madrid #valencia #seville #bilbao #malaga #oviedo #alicante #laspalmas #zaragozbanga #stockholm #zurich #geneva #basel #taipei #tainan #taichung #kaohsiung #Phuket #bangkok #istanbul #ankara #izmir #dubai #abudhabi #sharjah #london #manchester #liverpool #edinburgh #kiev #hcmc #hanoi #sanaa #taiz #aden #gibraltar #marrakech #lodz #wroclaw #poznan #Gdansk #szczecin #bydgoszcz #lublin #katowice #rio #salvador #fortaleza #brasilia #belo #belem #manaus #curitiba #portoalegre #saoluis data representation data analysis SQL data analytics analytics python (programming language) data mining data science r (programming language) tableau analytical skills data visualization databases business analysis business intelligence (bi) microsoft sql server machine learning statistics microsoft power bi java finance shopee traveloka google facebook ctrip trip.com makemytrip grab amazon pandas (software) artificial intelligence (ai) information technology capital one accenture upwork deloitte mckinsey bain microsoft uber lyft gojek lazada alibaba shopify expedia skyscannerEqual Opportunity Employer At Agoda, we pride ourselves on being a company represented by people of all different backgrounds and orientations. We prioritize attracting diverse talent and cultivating an inclusive environment that encourages collaboration and innovation. Employment at Agoda is based solely on a person’s merit and qualifications. We are committed to providing equal employment opportunity regardless of sex, age, race, color, national origin, religion, marital status, pregnancy, sexual orientation, gender identity, disability, citizenship, veteran or military status, and other legally protected characteristics.We will keep your application on file so that we can consider you for future vacancies and you can always ask to have your details removed from the file. For more details please read our privacy policy .To all recruitment agencies: Agoda does not accept third party resumes. Please do not send resumes to our jobs alias, Agoda employees or any other organization location. Agoda is not responsible for any fees related to unsolicited resumes."
